{
  "id": "seasonal_playbook",
  "route": "/seasonal-playbook.html",
  "title": "Seasonal Playbook",
  "widgets": [],
  "filters": [
    {
      "name": "location_focus",
      "effect": "Applies location context"
    },
    {
      "name": "date_range",
      "effect": "Applies analysis range"
    },
    {
      "name": "month_focus",
      "effect": "Targets single month"
    }
  ],
  "actions": [
    {
      "name": "update_trigger_profile",
      "effect": "Adjusts threshold interpretation context"
    }
  ],
  "permissions": [
    {
      "role": "owner",
      "capabilities": [
        "view",
        "configure"
      ]
    },
    {
      "role": "manager",
      "capabilities": [
        "view"
      ]
    }
  ],
  "sitemap_node_id": "seasonal-playbook",
  "owner": "ops-strategy",
  "version": "1.0.0",
  "status": "draft",
  "validation": {
    "basis": "approved_product_decision",
    "state": "validated_useful",
    "notes": "Wave 2 review passed. Useful as dedicated seasonal strategy surface. Follow-ups: resolve trigger editing ownership (dashboard read-only, playbook canonical), extract governed widgets from inline rendering, add change history for profiles.",
    "reviewed_on": "2026-02-24",
    "reviewer": "AlexUA"
  }
}
