{
  "id": "settings",
  "route": "/staffing-planner.html#settings",
  "title": "Settings",
  "widgets": [
    "operations_settings_panel",
    "compliance_scaffold_panel"
  ],
  "filters": [
    {
      "name": "settings_subtab",
      "effect": "Switches operations/compliance views"
    }
  ],
  "actions": [
    {
      "name": "update_guardrails",
      "effect": "Changes planner workflow constraints"
    },
    {
      "name": "update_opening_schedule",
      "effect": "Changes seasonal schedule assumptions"
    }
  ],
  "permissions": [
    {
      "role": "admin",
      "capabilities": [
        "view",
        "configure"
      ]
    },
    {
      "role": "manager",
      "capabilities": [
        "view"
      ]
    }
  ],
  "sitemap_node_id": "settings",
  "owner": "ops-admin",
  "version": "1.1.0",
  "status": "draft",
  "validation": {
    "basis": "approved_product_decision",
    "state": "validated_useful",
    "notes": "Wave 1 review passed. Useful as the only dedicated configuration surface for operational assumptions and compliance scaffolding. Follow-ups: migrate settings to server-side storage, prioritize compliance sub-tab implementation, add change audit log.",
    "reviewed_on": "2026-02-24",
    "reviewer": "AlexUA"
  }
}
