{
  "id": "shift_planner",
  "route": "/staffing-planner.html#shift_planner",
  "title": "Shift Planner",
  "widgets": [
    "shift_planner_day_card",
    "approvals_workbench_panel"
  ],
  "filters": [
    {
      "name": "location",
      "effect": "Selects store-specific plan context"
    },
    {
      "name": "horizon_weeks",
      "effect": "Sets number of generated planning weeks"
    },
    {
      "name": "week_start",
      "effect": "Shifts planning window"
    }
  ],
  "actions": [
    {
      "name": "submit_policy_change",
      "effect": "Creates pending day request"
    },
    {
      "name": "submit_next_week_for_approval",
      "effect": "Routes week to CEO approval gate"
    },
    {
      "name": "export_plan_json",
      "effect": "Produces schedule payload for publish flow"
    }
  ],
  "permissions": [
    {
      "role": "manager",
      "capabilities": [
        "view",
        "edit_schedule",
        "submit_request"
      ]
    },
    {
      "role": "admin",
      "capabilities": [
        "view",
        "edit_schedule",
        "approve_request",
        "export"
      ]
    }
  ],
  "sitemap_node_id": "shift-planner",
  "owner": "ops-workflow",
  "version": "1.0.0",
  "status": "draft",
  "validation": {
    "basis": "approved_product_decision",
    "state": "validated_useful",
    "notes": "Wave 1 review passed. Essential page â€” central composition surface for the plan -> validate -> approve -> publish workflow. Follow-ups: add server-side permission enforcement for approve/export, define filter persistence behavior.",
    "reviewed_on": "2026-02-24",
    "reviewer": "AlexUA"
  }
}
